DATE,url,tone,text
2017-05-26 12:45:00,http://www.einnews.com/pr_news/383318515/global-power-lithium-battery-market-2017-research-review-market-dynamics-key-players-segmentation-forecast-2022,-0.103412616339193,report cover market characteristic size growth segmentation regional breakdown competitive landscape market share trend strategy pune india einpresswirecom report study power lithium battery global market especially north america china europe southeast asia japan india production revenue consumption import export region forecast 2022this report focus manufacturer global market production price revenue market share manufacturer coveringrequest sample report samsungpanasonicbydtoshibacontemporary amperex technologyvalence technologygs yuasabostonpowerlg chemsonyhefei guoxuan hightech power energytianjin lishenwanxiang groupchina aviation lithium batteryoptimumnano energybakharbin coslight powermicrovastshandong winaby type market split intolicoo2 batterylimn2o4 batterylifecopo4 batteryotherby application market split intoelectronicsautomotiveaerospace defensemaritimeagricultural applicationotherby region report cover add regionscountries wantnorth americachinaeuropesoutheast asiajapanindiamake enquiry report special requirement let know offer report wanttable contentsglobal power lithium battery market professional survey report industry overview power lithium battery11 definition specification power lithium battery111 definition power lithium battery112 specification power lithium battery12 classification power lithium battery121 licoo2 battery122 limn2o4 battery123 lifecopo4 battery124 other13 application power lithium battery131 electronics132 automotive133 aerospace defense134 maritime135 agricultural application136 other14 market segment regions141 north america142 china143 europe144 southeast asia145 japan146 india2 manufacturing cost structure analysis power lithium battery21 raw material suppliers22 manufacturing cost structure analysis power lithium battery23 manufacturing process analysis power lithium battery24 industry chain structure power lithium battery3 technical data manufacturing plant analysis power lithium battery31 capacity commercial production date global power lithium battery major manufacturer manufacturing plant distribution global power lithium battery major manufacturer rd status technology source global power lithium battery major manufacturer raw material source analysis global power lithium battery major manufacturer global power lithium battery overall market overview41 overall market analysis42 capacity analysis421 20122017e global power lithium battery capacity growth rate analysis422 power lithium battery capacity analysis company segment43 sale analysis431 20122017e global power lithium battery sale growth rate analysis432 power lithium battery sale analysis company segment44 sale price analysis441 global power lithium battery sale price442 power lithium battery sale price analysis company segment5 power lithium battery regional market analysis51 north america power lithium battery market north america power lithium battery market overview512 north america 20122017e power lithium battery local supply import export local consumption analysis513 north america 20122017e power lithium battery sale price analysis514 north america power lithium battery market share analysis52 china power lithium battery market analysis521 china power lithium battery market overview522 china 20122017e power lithium battery local supply import export local consumption analysis523 china 20122017e power lithium battery sale price analysis524 china power lithium battery market share analysis53 europe power lithium battery market analysis531 europe power lithium battery market overview532 europe 20122017e power lithium battery local supply import export local consumption analysis533 europe 20122017e power lithium battery sale price analysis534 europe power lithium battery market share analysis54 southeast asia power lithium battery market analysis541 southeast asia power lithium battery market overview542 southeast asia 20122017e power lithium battery local supply import export local consumption analysis543 southeast asia 20122017e power lithium battery sale price analysis544 southeast asia power lithium battery market share analysis55 japan power lithium battery market analysis551 japan power lithium battery market overview552 japan 20122017e power lithium battery local supply import export local consumption analysis553 japan 20122017e power lithium battery sale price analysis554 japan power lithium battery market share analysis56 india power lithium battery market analysis561 india power lithium battery market overview562 india 20122017e power lithium battery local supply import export local consumption analysis563 india 20122017e power lithium battery sale price analysis564 india power lithium battery market share analysiscontinuedpurchase report
2017-05-26 12:45:00,http://energy.einnews.com/pr_news/383318515/global-power-lithium-battery-market-2017-research-review-market-dynamics-key-players-segmentation-forecast-2022,-0.0998003992015968,report cover market characteristic size growth segmentation regional breakdown competitive landscape market share trend strategy pune india einpresswirecom report study power lithium battery global market especially north america china europe southeast asia japan india production revenue consumption import export region forecast report focus manufacturer global market production price revenue market share manufacturer covering request sample report samsung panasonic byd toshiba contemporary amperex technology valence technology g yuasa bostonpower lg chem sony hefei guoxuan hightech power energy tianjin lishen wanxiang group china aviation lithium battery optimumnano energy bak harbin coslight power microvast shandong wina type market split licoo2 battery limn2o4 battery lifecopo4 battery application market split electronics automotive aerospace defense maritime agricultural application region report cover add regionscountries want north america china europe southeast asia japan india enquiry report special requirement let know offer report want table content global power lithium battery market professional survey report industry overview power lithium battery definition specification power lithium battery definition power lithium battery specification power lithium battery classification power lithium battery licoo2 battery limn2o4 battery lifecopo4 battery application power lithium battery electronics automotive aerospace defense maritime agricultural application market segment region north america china 143 europe southeast asia japan india manufacturing cost structure analysis power lithium battery raw material supplier manufacturing cost structure analysis power lithium battery manufacturing process analysis power lithium battery industry chain structure power lithium battery technical data manufacturing plant analysis power lithium battery capacity commercial production date global power lithium battery major manufacturer manufacturing plant distribution global power lithium battery major manufacturer rd status technology source global power lithium battery major manufacturer raw material source analysis global power lithium battery major manufacturer global power lithium battery overall market overview 20122017e overall market analysis capacity analysis 20122017e global power lithium battery capacity growth rate analysis power lithium battery capacity analysis company segment sale analysis 20122017e global power lithium battery sale growth rate analysis power lithium battery sale analysis company segment sale price analysis 20122017e global power lithium battery sale price power lithium battery sale price analysis company segment power lithium battery regional market analysis north america power lithium battery market analysis north america power lithium battery market overview north america 20122017e power lithium battery local supply import export local consumption analysis north america 20122017e power lithium battery sale price analysis north america power lithium battery market share analysis china power lithium battery market analysis china power lithium battery market overview china 20122017e power lithium battery local supply import export local consumption analysis china 20122017e power lithium battery sale price analysis china power lithium battery market share analysis europe power lithium battery market analysis europe power lithium battery market overview europe 20122017e power lithium battery local supply import export local consumption analysis europe 20122017e power lithium battery sale price analysis europe power lithium battery market share analysis southeast asia power lithium battery market analysis southeast asia power lithium battery market overview southeast asia 20122017e power lithium battery local supply import export local consumption analysis southeast asia 20122017e power lithium battery sale price analysis southeast asia power lithium battery market share analysis japan power lithium battery market analysis japan power lithium battery market overview japan 20122017e power lithium battery local supply import export local consumption analysis japan 20122017e power lithium battery sale price analysis japan power lithium battery market share analysis india power lithium battery market analysis india power lithium battery market overview india 20122017e power lithium battery local supply import export local consumption analysis india 20122017e power lithium battery sale price analysis india power lithium battery market share analysis continued purchase report
2017-05-26 22:45:00,http://investingnews.com/company-profiles/portofino-resources-lithium-argentina-catamarca/,1.796875,overview portofino resource inc tsxvporfwbpota canadian mineral resource company lithium gold project america company focus lithium brine project located argentina catamarca province leading lithium production center south america lithium triangle region salars world main source lithium carbonate production additionally portofinos lithium project located near key producer advancing project fmc lithium galaxy resource asxgxy lsc lithium corp tsxvlsc recent exploration work company hombre muerto west rio grande sur property yielded promising result hombre muerto west surface sampling program tested area interest returned lithium portofinos highestgrade brine assay date rio grande sur sample property tested returned value mgl potassium additionally lithium found springsourced surface water indicate area key source lithium salar portofinos project ii lithium iron horsebolivar goldsilver project seen extensive historical exploration historical result recovered project ii average lithium iron horsebolivar historically produced approximately tonne ore yielded gram gold gram silver demand lithium expected rise coming year reach approximately tonne demand fueled adoption clean energy initiative rising demand electric vehicle ev lithium play critical role implies lithium main component lithiumion battery looking capitalize rising gold price portofino recently acquired gold property red lake mining district near great bear resource ltds tsxvgbr dixie project historical exploration project includes prospecting sampling diamond drilling complement company existing ontario gold holding portofino resource recently announced binding agreement acquire claim totaling approximately hectare atikokan area northwestern ontario making melema west property moving forward portofino resource intends compile available assessment work historical data ontario property assist planning company future exploration program company highlight lithium brine project located province catamarca argentina approximately hectare near key producer advancing project ongoing program verify historical result indicating highgrade lithium potassium hombre muerto west sampling program returned highest date value lithium rio grande sur sampling program returned value mgl potassium experienced management excellent network regional community government connection prospective goldsilver property potential porphyry system british columbia property saw historic production gram gold gram silver
2017-05-29 09:30:00,http://www.stockhouse.com/news/press-releases/2017/05/29/lithium-energy-products-reports-on-the-results-of-gravitational-survey-on-the,-0.124843945068664,website address stockhouse changed changed address stockhouse website wwwstockhousecom stockhousecom page refreshes logged new address note stockhouse website us javascript place provide richer user experience accross multiple device browse website javascript disabled feature website not function designed not function javascript enabled page refresh automatically not tap button thank proceed stockhouse
2017-05-29 15:30:00,http://www.einnews.com/pr_news/383803079/critical-elements-successfully-completes-pilot-plant-work-for-lithium-carbonate-conversion,1.10497237569061,einpresswirecom montreal quebecmarketwired critical element corporation corporation critical element tsx venturecreotcqxcrecffrankfurtf12 pleased announce result pilot plant program recently completed company outotec demonstrated conversion critical element spodumene resource lithium carbonate battery quality thermal leaching process easily achievable knowns conversion process calcination thermal leaching bicarbonization crystallization spodumene concentrate lithium carbonate showed extremely good result extraction rate high purity lithium carbonate extraction rate surpasses worldwide average accepted industry standard purity reached impurity profile outstanding level sodium ppm calcium ppm iron ppm heavy metal ppm li co analysis impurity level li co table available following result demonstrated critical element approach lithium carbonate processing plant validated not require additional cost intensive purification step diagram illustrates critical element process flow diagram available following support low impurity profile ore allows production lithium carbonate battery quality competitive cost additional purification step said jeansebastien lavallee chairman ceo critical element supported test choosing technology ie thermal leaching process critical element demonstrated technological leadership result superior product lowest possible cost pilot plant work detail detail piloting work program achieve hour outotec pilot plant pilot operated hour shift hday day week pilot operated day hour hour shift following task slurry preparation sample pr leaching bicarbonization sample bcr leach residue filtration washing sample ww residue psd analysis polishing filtration filtrate sample t1 crystallization sample s3 filtrate caustification sample phr t2 li2co3 washing day sample s4li2co3 lc ww total solution sample solid sample day sample total date critical element completed following testing piloting work piloting chosen concentrator plant design critical element press release dated april piloting thermal conversion ore aspodumene bspodumene critical element press release dated april piloting thermal leaching process currently completed shown graphically graph available following based result work modelling conducted outotec critical element belief overall total recovery rate approach compare favorably industry standard typically low mid 60 recovery based following concentrator plant recovery92 possible indicated outotecs modelling decrepitation kiln recovery96 verified pilot plant thermal leaching process94 average verified pilot plant bicarbonizationlithium carbonate crystallization overall yield potentially high outotec leading technology company multiple mining extraction industry including lithium industry site frankfurt germany pori finland location offer competent knowledge processing option beneficiating spodumene converting spodumene saleable lithium salt lithium expertise includes multiple year research lithium processing option including understanding optimizing process critical element chosen lithium extraction jeansebastien lavallee ogq geologist shareholder chairman chief executive officer company qualified person ni reviewed approved technical content release critical element corporation recent financial analysis technical report preliminary economic assessment pea rose lithiumtantalum project genivar december rose project owned critical element based price forecast kg ta o contained tantalite concentrate t lithium carbonate li co showed estimated aftertax internal rate return irr rose project estimated net present value npv discount rate payback period estimated year pretax irr estimated npv discount rate mineral resource not mineral reserve not demonstrated economic viability preliminary economic assessment preliminary nature press release dated november pea includes inferred mineral resource considered speculative geologically economic consideration applied enable categorized mineral reserve certainty preliminary economic assessment realized conclusion pea indicate operation support production rate ton high purity battery grade li co pound ta o year life project host current indicated resource tonne li o eq li o ppm ta o inferred resource tonne li o eq li o ppm ta o tsx venture exchange regulation service provider term defined policy tsx venture exchange accepts responsibility adequacy accuracy release
2017-05-29 16:00:00,https://seekingalpha.com/article/4077171-let-leading-lithium-producer-recharge-portfolio,0.717213114754099,demand strong tesla tsla lately understatement stock price reflected sentiment currently trading near alltime high tsla data ycharts good thing elon musk not salesman admire determination vision sheer audacity market high expectation tsla encouraged small musk hiccup supply chain growth execution technology cause quick nasty pullback price stock stock performed tad priced perfection said potential especially relates ev battery technology want invest maintain exposure space looking alternative highflying tsla consider investing albemarle corporation nysealb world leader lithium production albemarle corporation world largest producer lithium key component manufacture battery ev solar panel host popular electronics cell phone cordless power tool alb data ycharts albemarle owns chemetallfoote lithium brinemine silver peak nevada working lithium united state conveniently happens located couple mile road tesla new battery manufacturing gigafactory silver peak produce estimated ton lithium needed annually supply gigafactory capacity addition albemarle significant lithium brinemine asset chile owns stake talison traditional mining operation australia diversified income stream business segment albemarle second largest producer bromine world bromine mainly flame retardant electronics fluid complete oil well low cost steady demand low risk segment business generates steady profit segment company design produce custom catalyst oil refining cracking catalyst formulated refinery based specific need refinery type crude processing formula refinery custom specific refinery business sticky meaning existing customer not tend change producer revenue model fairly predictable lithium operation drive growth bromine refining segment business provide low cost steady stream business lithium portion company drive bulk growth going forward albemarles lithium mine capacity scale meet expected strong market demand product addition company low cost provide stronger margin volume increase fact combination higher lithium price volume allow albemarle increase ebita double digit annually year come chilean mine lowest cost lithium operation world like brinemine nevada evaporation process require month acceptable lithium concentration realized australian expensive operation traditional mining technique greater volume shorter lead time mean ramp production quickly needed important advantage albemarle electric vehicle adoption increase not tesla major auto maker like ford f general motor gm toyota tm developing electric hybrid vehicle demand lithium expected grow doubledigit annual rate year come graphic albemarle corporate presentation illustrates company expects demand portable battery application expected continue grow linear fashion demand auto battery forecasted start growing exponentially primarily result increased demand ev demand pricing lithium remain strong demanddriven lithium price increased past year result company recently reported impressive margin lithium operation q117 increase yoy q116 record adjusted ebitda net sale q117 versus adjusted ebitda net sale prior year quarter driven expectation continued strong improvement volume pricing albemarle management provided guidance increase adjusted ebitda best come ev make global vehicle sale industry forecast ev adoption reach upwards accurate estimate mean industry experience growth rate year albemarle sizable global asset positioned benefit demand largest arguably lowest cost producer lithium critical component large battery albemarle offer best opportunity advantage expected growth ev hybrid vehicle penetration core longterm holding growth portfolio
2017-05-30 13:45:00,http://energy.einnews.com/pr_news/383954018/liberty-one-lithium-appoints-patrick-whibley-to-board,2.25563909774436,einpresswirecom vancouver becausemarketwired liberty lithium corp liberty company tsx venture lby emerging exploration company focused acquisition development high grade lithium brine deposit pleased announce appointment mr patrick whibley board director mr whibley finance professional year capital market experience prior joining liberty lithium mr whibley served extensively investment advisor pi financial global security vancouver assisted raising significant capital venture company gopublic stage mr whibley built career cultivating strong relationship network retail highnet worth client broker analyst investment banker related news company board director announces departure desmond balakrishnan departs best wish thanks service company period formation liberty lithium corp visit wwwlibertyonelithiumcom view company filing wwwsedarcom behalf board director bradley hoeppner bradley hoeppner ceo director liberty lithium tsx venture lby liberty lithium corp emerging exploration company focused acquisition development high grade lithium brine deposit company belief global resource key robust energy strategy protect economic stability worldwide find wwwlibertyonelithiumcom cautionary statement forwardlooking statement contained press release forwardlooking statement meaning applicable security law forwardlooking statement identified use word anticipates plan expects intends expected potential suggests variation word phrase statement certain action event result taken occur achieved forwardlooking statement not historical fact subject number risk uncertainty company control actual result development likely differ differ materially expressed implied forwardlooking statement contained news release accordingly reader not place undue reliance forwardlooking statement company undertakes obligation update publicly revise forwardlooking statement required law tsx venture exchange regulation service provider term defined policy tsx venture exchange accepts responsibility adequacy accuracy release
2017-05-30 16:45:00,http://www.einnews.com/pr_news/383988554/advantage-lithium-announces-company-tier-reclassification,1.97841726618705,einpresswirecom vancouver british columbiamarketwired advantage lithium corp company advantage lithium tsx ventureaalotcqxavlif pleased announce accordance policy company met requirement tier company effective tuesday company tier classification change tier tier advantage lithium corp advantage lithium corp resource company specializing strategic acquisition exploration development lithium property headquartered vancouver british columbia common share company listed tsx venture exchange tsx ventureaal company traded otcqx best market yous otcqxavlif company signed loi subject definitive agreement lithium producer orocobre subject definitive agreement acquire interest project argentina interest sixth called cauchari cauchari host nearsurface estimated inferred resource cubic metre brine lithium equates tonne lithium carbonate lce large exploration target 56mt 025mt lce 19mt kcl cauchari located km south orocobres flagship olaroz lithium facility company earning interest nevada sunrise gold corp portfolio lithium brine project clayton lida valley region nevada usa including clayton ne addition company acquired stella mary lithium brine project immediately adjacent orocobres salina grandes project host inferred nearsurface resource argentina lithium triangle company found wwwadvantagelithiumcom advantage lithium corp david sidoo president cautionary statement certain contained press release constitutes forwardlooking meaning canadian legislation generally forwardlooking statement identified use forwardlooking terminology expected intends potential forward looking statement contained press release include statement future operating financial performance advantage involve known unknown risk uncertainty not prove accurate actual result outcome differ materially expressed forecasted forwardlooking statement statement qualified entirety inherent risk uncertainty surrounding future expectation forwardlooking statement included press release date press release company disclaims intention obligation update revise forwardlooking statement result new future event expressly required applicable security legislation tsx venture exchange regulation service provider term defined policy tsx venture exchange accepts responsibility adequacy accuracy release
