DATE,url,tone,text
2017-06-07 19:30:00,http://www.finanznachrichten.de/nachrichten-2017-06/40908492-stock-report-two-lithium-stocks-looking-to-make-their-mark-cash-in-200.htm,-0.238663484486874,miami fl accesswire june lithium industry expected experience exponential growth year according allied market research lithium industry expected reach consumer use lithiumion battery day smart phone laptop medical technology electric car lithiumion battery everyday life consumer worldwide current expected increase demand lithium wonder company domestic international emerging meet global demand liberty lithium corp lrttf engages acquisition exploration development mining property canada united state company primarily explores lithium brine deposit hold interest paradox north property placer claim covering acre located paradox basin grand county utah option earn interest pocitos west project covering hectare located salta province argentina report lrttf found company quiet beginning moving forward according release sedar company raised roughly cad private placement addition private placement liberty lithium corp announced sedar 19th entered mineral property option agreement millennial lithium corp acquire interest pocitos west project consisting hectare acre prospective lithium brine exploitation concession pocitas salar salta province argentina lithium america corp otcqx lacdf resource company engages acquisition exploration development mineral property nevada company explores lithium deposit primarily hold interest cauchariolaroz project located jujuy province argentina lithium nevada project covering approximately hectare area located northwestern nevada company known western lithium usa corporation changed lithium america corp march lithium america corp incorporated headquartered vancouver canada june lithium america corp announced completed closing investment agreement gfl international co ltd whollyowned subsidiary jiangxi ganfeng lithium co ltd pursuant investment agreement ganfeng lithium agreed provide lithium america aggregate approximately us172 financing tom hodgson lithium america ceo commented welcome ganfeng lithium largest shareholder closing investment agreement place lithium america strong financial position allow company commence construction cauchariolaroz lithium project joint venture partner sqm objective low cost brine producer lithium stockreport stockreport owned mad medium publishing llc nevada corporation sr produce regular sponsored nonsponsored report article stock market blog popular investment newsletter covering equity listed nyse nasdaq microcap stock sr not compensated directly indirectly producing publishing document principal associated midam venture llc previously compensated pyronix medium period beginning ending publicly disseminate liberty lithium corp lrttf including website medium including facebook twitter paid cash paid share restricted unrestricted common stock not offering document not intended offering recommendation solicitation offer buy sell security mentioned discussed informational purpose read associated disclosure disclaimer investing sr party affiliated registered investment adviser brokerdealer agency jurisdiction whatsoever download report read disclosure visit warranty sr author reviewer collectively referred publisher not responsible error occasioned time printing document error mistake shortcoming liability accepted publisher whatsoever direct indirect consequential loss arising use document publisher expressly disclaim fiduciary responsibility liability consequence financial arising reliance placed document additionally publisher not guarantee accuracy timeliness completeness correct sequencing warrant result use included subject change notice inforeport source stockreport
2017-06-07 20:00:00,http://www.finanznachrichten.de/nachrichten-2017-06/40908605-navitas-systems-announces-first-ul-recognized-starlifter-lithium-batteries-for-both-the-heavy-duty-class-1-and-2-lift-truck-market-200.htm,0.394321766561514,starlifter lithium battery ul certified rideon class lift truck presenting broadest commercially available lithium lift truck battery product line woodridge il accesswire june navitas system llc wwwnavitassyscom leading provider heavyduty lithium energy storage product commercial industrial governmentmilitary customer announced today achieved ul recognition complete lineup starlifter volt volt volt lithium forklift battery class class class lift truck category mark time ul concurrently tested certified heavy duty class class lithium battery forklift testing largeamphour multivoltage lithium forklift battery required unique approach said ibrahim jilani business development manager uls energy system emobility team conducted numerous sophisticated test parallel proud work navitas ul handle broad range multikilowatt hour multivoltage pack comprised starlifter lithium product family navitas starlifter line battery range kilowatt hour optimized heavyduty rigor larger class sit downcounterbalance lift truck class reach truck class rideon pallet truck year career lithium battery overseen submittal battery ul testing said alan elshafei chairman founder navitas system starlifter submittal order magnitude challenging delighted skill exhibited engineering testing manufacturing team develop robust safe lithium battery architecture survive rigor gauntlet strenuous testing pas flying color mr elshafeis leadership year million battery shipped recall fire designforsafety paramount starlifter product line ul recognition standard testing battery use large electric vehicle starlifter testing program conducted ul involved number critical test overcharge internal short circuit imbalance charge shock crush nail penetration thermal abuse discharge rotation vibration addition test starlifter demonstrated compliance ul requirement battery management software ul hardware evaluation test achieved significant result number reason said kevin hykin navitas president chief operating officer having talented set battery scientist engineer prior acquisition government solution division a123 system group previously designed automotive military battery enabled apply system approach day starlifter design began early second worked early lift truck manufacturer embed key design requirement invested heavily engineering larger class rideon class lift truck battery market segment justify higher initial purchase cost demonstrated materialhandling productivity improvement strong return investment commercial government customer alike decade utilized lead acid battery power electric forklift truck battery relatively inexpensive purchase suffer number significant drawback including slow recharging fading performance discharging constant maintenance productivity downtime changing battery given historical performance limitation lead acid combined increased prevalence fast charger new powerhungry ac forklift motor strong need better battery solution particularly intensive shift operation cold temperature warehouse environment operation starlifter excels demonstrating yearly productivity gain pallet moved shift time cycle life lead acid battery superior ability rapidly recharge hour resulting typical payback year navitas starlifter battery tested fortune customer year robust performance result navigant research expects coming decade liion battery advanced electric technology choice traction energy forklift beating advanced leadacid battery fuel cell said ian mcclenny energy analyst navigant research value liion battery create fastcharging capability uniquely position traditional powertrains help increase factory throughput forklift powered liion battery help increase onthejob safety eliminate bulky charging infrastructure necessary battery type help improve operating efficiency especially multiple shift day cold storage operation navitas showcasing family starlifter lithium forklift battery month june booth global cold chain exposition chicago illinois food industry executive share relevant identify critical issue discus key topic increase awareness storage distribution perishable item navitas starlifter deployment food distribution company starlifter enjoys runtime advantage lead acid cold temperature typically found distribution company recently concluded twoyear study funded state new york nyserda raymond corporation navitas system test starlifter independent test lab major new york food distributor showed starlifterpowered lift truck yielded improvement pallet moved hour compared lead acid powered lift truck intensive shift operation cold temperature food warehouse navitas system llc navitas system leader integrated design technology development manufacturing innovative energyenabled system solution energy storage product commercial industrial government agency customer navitas system product range customized energy storage solution motive idlereduction defense related application custom renewable energy integrated power system standard product like lithium based leadacid replacement battery ruggedized lithium energy storage product perfect choice highperformance multicell battery application requires lower weight reduced volume massively increased cycle life higher efficiency environmental durability navitas headquartered stateoftheart square foot facility woodridge illinois early company acquired government solution group lithium battery manufacturer a123 system acquired advanced battery group located square foot rd engineering manufacturing center ann arbor michigan strong local offshore partner solid financial stability navitas positioned continue serving energy product power electronics need major worldwide customer advanced rd safehigh energy cell design inhouse electronics manufacturing cable assembly sophisticated battery pack assembly navitas system onestop shop comprehensive energy power electronics solution partner navitas system leslie anderson landerstoncom navitas system visit wwwnavitassyscom starlifter visit wwwlithiumforkliftpowercom leslie anderson landersoncom source navitas system llc
2017-06-08 14:00:00,http://investingnews.com/company-profiles/lithium-northwest-territories-utah-nevada-equitorial-exploration/,0.743034055727554,overview equitorial exploration tsxvexx fraee1 otcqbeqtxf canadian mineral exploration company focused developing diverse portfolio whollyowned lithium project north america company flagship property little nahanni pegmatite group lnpg project northwest territory host lithiumcesiumtantalum type mineralization common today large highgrade hard rock mine equitorial exploration portfolio contains highly prospective project cat lake manitoba tule valley utah gerlach nevada sampling lnpg project returned grade range percent percent lithium oxide higher industry average percent percent proximity infrastructure including processing facility cantung owned northwest territory government lead management believe lnpg potential nearterm producer lithium market company highlight whollyowned hard rock brine lithium property excellent potential strategic location
2017-06-08 23:00:00,https://www.benzinga.com/pressreleases/17/06/n9586755/advantage-lithium-grants-stock-options,1.0989010989011,tsx venture exchange symbol aal vancouver june cnw advantage lithium corp company advantage lithium aal avlif announces granting stock option insider company purchase common share price share period year advantage lithium corp advantage lithium corp resource company specializing strategic acquisition exploration development lithium property headquartered vancouver british columbia common share company listed tsx venture exchange tsxvaal company traded otcqx best market yous avlif company acquired interest project argentina interest sixth called cauchari cauchari located km south orocobres flagship olaroz lithium facility company earning interest nevada sunrise gold corp portfolio lithium brine project clayton lida valley region nevada usa including clayton ne company found wwwadvantagelithiumcom advantage lithium corp david sidoo david sidoo president fax infocom cautionary statement certain contained press release constitutes forwardlooking meaning canadian legislation generally forwardlooking statement identified use forwardlooking terminology expectedintends potential forward looking statement contained press release include statement future operating financial performance advantage involve known unknown risk uncertainty not prove accurate actual result outcome differ materially expressed forecasted forwardlooking statement statement qualified entirety inherent risk uncertainty surrounding future expectation forwardlooking statement included press release date press release company disclaims intention obligation update revise forwardlooking statement result new future event expressly required applicable security legislation tsx venture exchange regulation service provider term defined policy tsx venture exchange accepts responsibility adequacy accuracy release source advantage lithium corp view original content
2017-06-09 15:00:00,http://www.einnews.com/pr_news/385916018/the-layered-look-of-lithium-sulfur,-1.68350168350168,quest longerlasting lithium rechargeable battery researcher looking use sulfur electrode chemistry lithiumsulfur theory allow electric vehicle twice far conventional battery practice unwanted chemical reaction clog electrode quickly meaning short lifespan battery ability hold charge fade researcher gotten best look going lithiumsulfur battery charging discharging adapt laboratory instrument trap product unwanted chemical reaction team saw component battery electrode liquid electrolyte help create electric current interact form interfering layer electrode understanding layer build help scientist solve lithiumsulfur fading problem lead affordable battery sulfur significantly cheaper current cathode material lithiumion battery said researcher vijay murugesan department energy pacific northwest national laboratory total cost lithiumsulfur battery low find team pnnl texas university joint center energy storage research learned combined computational modeling data modified instrument work performed emsl environmental molecular science laboratory doe office science user facility located pnnl
2017-06-10 15:15:00,http://www.smh.com.au/world/lithium-bolivia-20170523-gwb8me.html,0.809935205183586,meeting rio tinto chilean government reignited speculation bid lithium asset credit matjaz krivic quantity negligible wider scheme thing depth world largest salt flat claimed contain world largest lithium reserve according estimate bolivian andes harbour cent planet lithium number study corroborate claim according optimistic ton lithium available salar de uyuni pessimistic geological survey foretells merely ton vast quantity lithium detected world ocean little wonder mining industry planet toxic enterprise turning gaze downward sea lithium stock rattled fear oversupply week credit matjaz krivic llipi lithium plant located redbrown rio grande river founding stone laid socialist firebrand bolivian president evo morale lot pomp visionary rhetoric morale let fly prediction great hope country spoil oil 21st century inspired envision onceinalifetime opportunity right number historical wrong soon ascent power morale rode crest leftist policy latin america nationalise natural resource oil natural gas kind mineral imagine land natural resource richness long curse bolivian people brought richness colonial master finally turned great advantage far sweeping idealistic vision failed materialise truckies view town rio grande credit matjaz krivic thing stand bolivia simply not sufficiently skilled personnel optimally exploit natural wealth chasing boom final stage lithium production process credit matjaz krivic bolivia see lithium great strategic project aware significant market expansion mean say miguel parra head production llipi plant parra met office shore salt lake pilot project run course april brand new lithium factory lake completion mean colossal government project lithium extraction enter second stage tesla lithiumion battery pack tesla gigafactory spark nevada credit ap obvious manager stateowned company hurry market lithium carbonate easily triple year price white powder surging lithium efficient battery component far fuel not mobile phone laptop gaming console solar panel robot electric vehicle critical observer note production pilot plant proceeding laidback pace state project parra explains directed la paz moving slowly way extraction process salar de uyuni complicated neighbouring argentina chile country salt lake located lower altitude drier climate lithium trapped considerably magnesium potassium week bolivian parliament set create special stateowned firm evaporative resource lithium production able sign contract domestic foreign private company new oil bolivian market opening attracting attention japanese german swede french swiss korean canadian source american electric giant tesla want action battery tesla model s requires kilogram lithium carbonate power approximately cell battery recent report goldman sachs investment bank called lithium carbonate new gasoline year world yearly demand expected total ton cent increase electric vehicle production increase lithium demand cent current global production report boldly state fmc employer wished develop uyuni late 80 early 90 claim joe lowry head global lithium company world leading authority lithium governmental chaos poor infrastructure deal argentina ultimately got chosen year later bolivia lack infrastructure sort government investor comfortable somewhat sceptical bolivia lithium success story lowry little doubt lithium carbonate lithium battery market set explode sharp rise lithium battery consumption strongly tied wholesale boom call electrical transport electric car forerunner world population travel daily bus scooter bike mus lowry dubbed mr lithium follower twitter electric bus preplanned route distance mean charging process easily worked daily routine online shopping good increasingly delivered automated electric vehicle broad transportation platform not solely dependent car not bullish pace electric vehicle adoption believe past point wondering significant etransport growth real question hinge bringing battery cost opinion happen according mr lithium argentina chile remain main player bolivia certainly seeing growth having spent year living china lowry know talking world largest lithium market china major supplier ganfeng tianqi key resource supporting company located abroad lithium business global interdependent understood chinese syndrome according economist leading bolivian lithium analyst juan carlos zuleta calderon essential government planner la paz team experienced foreign company maybe hire work bolivian watch learn eventually charge project far chinese one bolivian allowed grand national project past year china gathering natural wealth exploitation concession developing world impact environment ruinous american european corporation analyst world long noted china ideological nimbleness naked greed leader latin american african country september china destination bolivia export delivery comprised ton lithium carbonate true shipment symbolic source comibol bolivia set price us9200 ton make shipment gift thank note china generous help infrastructure construction according parra approximately cent plant lithium output sold china small shipped o sweden rest allocated chinesebuilt lithium battery factory potosi bolivia parra quick add basic distribution ratio not likely change open vein latin america flaming sun slowly setting world greatest salt flat huge ominous looking shadow descending vista blazing white distance lone islet look like egyptian pyramid expansive horizon bypass mind directly address soul icy evening wind start pick quickly cutting bone defeat implicit victory wealth generated poverty nourishing prosperity empire native overseer colonial neocolonial alchemy gold change scrap metal food poison word great uruguayan writer eduardo galeano describe continent situation decade ago open vein latin america century pillage continent
