DATE,url,tone,text
2017-05-10 13:45:00,http://www.prnewswire.com/news-releases/the-demand-for-lithium-and-cobalt-markets-621863743.html,1.07323232323232,new york prnewswire research market market indicates lithium ion battery market expected valued usd growing cagr largely attributed increasing popularity electric plugin hybrid vehicle lithium ion battery power source increasing demand smart device consumer electronics help propel lithium market smartphones tablet sourcinglinknet inc otc snet leading edge material corp otc lemif galaxy resource limited otc galxf pure energy mineral limited otc pemif lithium america corp otc lacdf report specifies growing importance cobalt play advancing battery market lithium ion battery market lithium nickel manganese cobalt battery type expected grow highest rate lithium nickel manganese cobalt linmc type battery application area like ebikes power tool medical equipment electric powertrains usage cobalt ratio combined nickel manganese supply optimum result keeping cost low cobalt expensive energy density linmc battery primary strength sourcinglinknet inc otc snet april 26th announced intention pursue additional claim expand cobalt market company final negotiation cobalt property expecting purchase option acquire cobalt claim vicinity snets existing lac fire lithium claim james bay quebec canada cobalt complimentary lithium term us battery power electric car laptop cell phone camera market mineral showing increasing strength believe natural progression snet include cobalt portfolio make sense lithium cobalt recent history regularly show demand increasing said anne carioti ceo february leading edge material corp otcqb lemif announces staking company second cobalt co copper cu project kontio located north eastern finland approximately km northwest town kuusamo project secured leading edge material hectare kontiosarvivaara reservation valid september kontio project lie kuusamo schist belt host numerous significant deposit eastern finland kuusamo schist belt comprised metasedimentary sequence regular mafic felsic intrusive regional scale albite alteration galaxy resource limited otc galxf lithiumfocused resource company asset spanning australia canada argentina galaxy currently advancing plan develop sal de vida lithium potash brine project sal de vida argentina situated lithium triangle region chile argentina bolivia meet presently account global lithium production april company provided update development work sal de vida sdv project sdv project team reestablished ground development site location recommenced development work line recently established development budget schedule pure energy mineral limited otcqb pemif lithium resource developer driven lowcost supplier growing lithium battery industry company current focus development cv lithium brine project adjoining glory lithium clay project clayton valley nevada company recently announced result depthspecific brine sample exploratory well cv7 cv8 clayton valley south project cv project positive indication lithium mineralization occurred screened interval well increased concentration deeper sample average lithium concentration screened interval cv7 milligram liter mgl lithium ranging lithium cv8 sample averaged mgl including range lithium value lithium america corp otcqx lacdf joint venture sociedad quimica y minera de chile sqm developing cauchariolaroz brine deposit jujuy argentina march company provided result definitive feasibility study stage dfs cauchariolaroz lithium project cauchariolaroz project cauchariolaroz owned minera exar sa minera exar argentine company owned lithium america sqm minera exar pursuing development plan cauchariolaroz production capacity tonne annum tpa batterygrade lithium carbonate li2co3 stage stage consisting tpa li2co3 sign receive alert trending financial news company latest buzz financial news subscribe watch report nyse follow twitter real time financial news update follow talk instagram facebook like receive live feed financialbuzzcom financialbuzzcom leading financial news informational web portal designed provide latest trend market news investing news personal finance politics entertainment indepth broadcast stock news market analysis company interview pioneer financially driven digital space video production integration social medium financialbuzzcom creates unique original content financialbuzzcom provides financial news pr dissemination branding marketing advertising party corporate news original content unique medium platform includes newswire delivery digital advertising social medium relation video production broadcasting financial publication note financialbuzzcom not financial advisory advisor investment advisor brokerdealer not undertake activity require registration provided site original financial news paid advertisement provided exclusively affiliate sponsored content financialbuzzcom financial news medium marketing firm enters medium buy service agreement company subject article posted site editorial advertising company financialbuzzcom not compensated directly company mentioned editorial not independent news medium provider not represent warrant posted site accurate unbiased complete financialbuzzcom receives fee producing presenting high quality sophisticated content financialbuzzcom financial news pr medium service financialbuzzcom not offer personal opinion bias commentary purely incorporate public market financial corporate news financialbuzzcom aggregate regurgitates financial corporate news unique financial newswire medium platform release financialbuzzcom compensated dollar financial news dissemination pr service party non affiliate sourcinglinknet inc fee flat cash sum negotiated number security company featured editorial site combination thereof security commonly paid segment portion received engagement balance paid near conclusion engagement financialbuzzcom disclose compensation security cash payment financial news pr advertising financialbuzzcom not undertake update editorial site continue post company contained not intended basis investment decision not considered investment advice recommendation contained not offer solicitation buy hold sell security financialbuzzcom member affiliate not responsible gain loss result opinion expressed editorial site company profile quotation material presentation publishes electronically print investor accept responsibility investment decision based independent research evaluation investment goal risk tolerance financial condition financialbuzzcom accessing editorial website page thereof agree bound term use privacy policy amended time time content issued financialbuzzcom constitutes recommendation investor purchase hold sell particular security pursue particular investment strategy security suitable investor publication provided financialbuzzcom investor solely responsible determining particular security investment strategy suitable based objective security holding financial situation need tax status agree consult investment advisor tax legal consultant making investment decision representation completeness accuracy timeless material provided material subject change notice obtained source believed reliable accuracy completeness not guaranteed disclaimer disclosure term use visit medium protected url source financialbuzzcom
2017-05-10 15:00:00,http://www.finanznachrichten.de/nachrichten-2017-05/40673177-lithium-americas-appoints-president-south-american-operations-and-provides-update-on-strategic-financing-with-ganfeng-lithium-256.htm,1.00418410041841,vancouver british columbia marketwired lithium america corp lithium america company tsx lacotcqx lacdf pleased announce completed closing investment agreement investment agreement gfl international co ltd whollyowned subsidiary jiangxi ganfeng lithium co ltd ganfeng lithium pursuant investment agreement ganfeng lithium agreed provide lithium america aggregate approximately us172 financing described company press release dated january connection closing investment agreement party completed issue sale remaining common share price c085 common share gross proceeds approximately c54 us40 executed credit agreement us125 credit facility executed offtake agreement purchase sale lithium product combined common share us7 issued january pursuant initial equity installment investment agreement ganfeng lithium hold common share company tom hodgson lithium america ceo commented welcome ganfeng lithium largest shareholder closing investment agreement place lithium america strong financial position allow company commence construction cauchariolaroz lithium project joint venture partner sqm objective low cost brine producer lithium ganfeng lithium ganfeng lithium largest integrated lithium producer china total capacity tonne annum lithium carbonate equivalent ganfeng lithium product include lithium metal lithium hydroxide lithium carbonate lithium fluoride lithium chloride australia ganfeng lithium owns interest mount marion lithium spodumene project mineral resource ltd neometals ltd ganfeng lithium founded listed shenzhen stock exchange current market capitalization approximately us5 lithium america lithium america sqm developing cauchariolaroz lithium project located jujuy argentina interest minera exar addition lithium america owns lithium nevada project king valley project rheominerals inc supplier rheology modifier oilbased drilling fluid coating specialty chemical forwardlooking statement statement release forwardlooking subject risk uncertainty concerning specific factor disclosed company periodic filing canadian security regulator forwardlooking news release includes date credit agreement effective occurs concurrent drawdown document word intent target expect estimated scheduled similar expression represent forwardlooking provided document necessarily summarized not contain available material forwardlooking statement based certain assumption analysis lithium america management light experience perception historical trend current condition expected future development factor management belief appropriate circumstance including case credit agreement ganfeng implementation agreed security interest structure satisfaction customary condition drawdown statement subject variety risk uncertainty factor cause actual event result differ materially projected forwardlooking statement important factor cause actual result differ forwardlooking statement include described heading risk factor lithium america recently filed mda annual form continuous disclosure filing company not intend expressly disclaims obligation update revise forwardlooking contained news release required law reader cautioned not place undue reliance forwardlooking statement contact lithium america corp investor relation ircom wwwlithiumamericascom
2017-05-10 16:30:00,http://www.stockhouse.com/news/press-releases/2017/05/10/lithium-americas-appoints-president-south-american-operations-and-provides,0.762631077216397,website address stockhouse changed changed address stockhouse website wwwstockhousecom stockhousecom page refreshes logged new address note stockhouse website us javascript place provide richer user experience accross multiple device browse website javascript disabled feature website not function designed not function javascript enabled page refresh automatically not tap button thank proceed stockhouse
2017-05-10 21:30:00,http://time.com/4774826/laptop-ban-planes-europe-lithium-batteries/,-4.70809792843691,trump administration likely expand ban laptop commercial aircraft include european country reviewing ensure lithium battery stored luggage hold not explode midair official briefed matter said wednesday expansion ban impact yous carrier united airline delta air line inc american airline group yous european official said expect yous department homeland security dhs announcement declined march yous announced laptop restriction flight originating airport including uae saudi arabia qatar turkey fear concealed bomb installed electronic device taken aircraft britain quickly followed suit restriction slightly different set route european official acknowledged expanded ban affect flight united state britain dhs spokesman dave lapan said homeland security secretary john kelly not decision continue evaluate threat environment engaged discussion airline representative stakeholder threat kelly classified briefing thursday senator domestic threat airline issue expected discussed congressional aide briefed matter said yous laptop ban affected direct flight united state royal jordanian airline egypt air turkish airline saudi arabian airline kuwait airway royal air maroc qatar airway emirate etihad airway issue discussion ensure lithium battery large collection device stored airplane hold not explode midair official told reuters european regulator warned placing potentially hundred device hold longhaul flight compromise safety increasing risk fire poorly deactivated lithiumion battery tuesday reuters reported united nation agency begun effort craft global guidance use laptop portable electronics passenger aircraft cabin ban upset airline passenger middle eastern carrier international civil aviation organization met tuesday debate issue united arab emirate egypt country complained airline unduly penalized decision source familiar matter told reuters airport airline europe working plan possible extension ban yous announced restriction larger electronic device cabin according industry source issue need resolved include best inform passenger new restriction disruption airport minimum operational measure stopping online checkin yous bound flight ensuring yous flight depart dedicated terminal idea mulled decision taken letterscom
2017-05-11 04:15:00,https://www.bloomberg.com/news/articles/2017-05-11/lithium-miner-orocobre-denies-plans-to-list-shares-in-argentina,-0.311526479750779,bloomberg technology daily news program focused exclusively technology innovation future business hosted ed ludlow san francisco caroline hyde new york
2017-05-11 10:15:00,https://www.bloombergquint.com/markets/2017/05/11/lithium-miner-orocobre-denies-plans-to-list-shares-in-argentina,0.523560209424084,orocobre based milton area brisbane traded toronto stock exchange company seeking complete listing soon week sell share operation according people asked not identified talk private
2017-05-11 14:00:00,http://www.prnewswire.com/news-releases/the-importance-of-lithium-and-cobalt-in-todays-energy-market-621990303.html,1.14114114114114,new york prnewswire lithiumion battery efficient source energy rechargeable storage device capable expanding battery durability leading increasing power source consumer electronics including hybrid electric vehicle according research techsci research global lithiumion battery market projected grow cagr term energy demand expected increase ton oil equivalent mtoe mtoe scientific metal corp otc sctff tsxv stm ecobalt solution inc otc ecsif panasonic corporation otc pcrfy lundin mining corporation otc lunmf fmc corporation nyse fmc report rockstoneresearch indicates importance cobalt market growth liion battery industry contributed boom graphite lithium space likely result growing demand cobalt given key material input liion battery cell cobalt price started rising long way prefinancial crisis high second geopolitical situation brewing drc country responsible annual global primary cobalt production development turn sour current president joseph kabila fails step end real possibility outbreak unrest country lead significant disruption cobalt output country likely result global cobalt supply squeeze scientific metal corp otcqb sctff tsxv stm april 26th reported launched exploration program iron creek cobalt project initially commencing rehabilitation underground working company finalizing plan claim staking contractor expand size property claim staking commence claim staking soon snow pack melt allows surface underground drilling campaign final stage planning follow underground surface mapping sampling program work conducted patented lode mining claim cover historic resource identified company news release dated september summary project company commenced rehabilitation portal underground tunnel currently combined length foot access mineralized zone portal adit new timber installed surface access gained entire length tunnel connected adit rehabilitation tunnel completed prior planned underground sampling mapping program followed underground drilling contractor selected complete underground drilling company plan conduct geophysical survey known mineralized zone identify method assist locating drill target extensive surface sampling sediment soil outcrop planned ecobalt solution inc otcqb ecsif commits providing ethically produced environmentally sound battery grade cobalt salt essential rapidly growing rechargeable battery renewable energy sector safely responsibly transparently united state company primary asset owned idaho cobalt project remains advanced stage near term environmentally permitted primary cobalt deposit united state icp comprised minemill mm site located lemhi county idaho near town salmon idaho cobalt production facility cpf standalone hydrometallurgical facility expected located southern idaho panasonic corporation otc pcrfy recently announced held opening ceremony new automotive lithiumion battery factory dalian china factory panasonics automotive battery cell production site china panasonic strengthen global competitiveness automotive battery industry establishment production site japan united state china panasonic provided automotive lithiumion battery number auto manufacturer global basis leading automotive battery market furthermore response increase demand highperformance automotive lithiumion battery panasonic not increased production japanese site start automotive battery cell production united state lundin mining corporation otc lunmf diversified canadian base metal mining company operation chile united state america portugal sweden company hold indirect percent equity stake freeport cobalt oy business includes cobalt refinery located kokkola finland refinery process unrefined cobalt related metal manufacture advanced inorganic product use variety application fastgrowing end use market fmc corporation nyse fmc served global agricultural industrial consumer market innovative solution application quality product company operates business segment fmc agricultural solution fmc health nutrition fmc lithium fmc announced new longterm supply agreement nemaska lithium inc agreement nemaska provide fmc metric ton year lithium carbonate beginning mid2018 based quebec canada nemaska lithium inc constructing new lithium production capability metric ton lithium carbonate equivalent sign receive alert trending financial news company latest buzz financial news subscribe watch report nyse follow twitter real time financial news update follow talk instagram facebook like receive live feed financialbuzzcom financialbuzzcom leading financial news informational web portal designed provide latest trend market news investing news personal finance politics entertainment indepth broadcast stock news market analysis company interview pioneer financially driven digital space video production integration social medium financialbuzzcom creates unique original content financialbuzzcom provides financial news pr dissemination branding marketing advertising party corporate news original content unique medium platform includes newswire delivery digital advertising social medium relation video production broadcasting financial publication note financialbuzzcom not financial advisory advisor investment advisor brokerdealer not undertake activity require registration provided site original financial news paid advertisement provided exclusively affiliate sponsored content financialbuzzcom financial news medium marketing firm enters service agreement company subject article posted site editorial advertising company not independent news medium provider not represent warrant posted site accurate unbiased complete financialbuzzcom receives fee producing presenting high quality sophisticated content financialbuzzcom financial news pr medium service financialbuzzcom not offer personal opinion purely incorporate public market research financial corporate news financialbuzzcom aggregate regurgitates financial corporate news unique financial newswire medium platform financialbuzzcom signed threemonth agreement compensated dollar financial news dissemination pr service scientific metal corp fee flat cash sum negotiated number security company featured site combination thereof security commonly paid segment portion received engagement balance paid near conclusion engagement financialbuzzcom disclose compensation security cash payment financial news pr advertising financialbuzzcom not undertake update site continue post company contained not intended basis investment decision not considered investment advice recommendation contained not offer solicitation buy hold sell security financialbuzzcom member affiliate not responsible gain loss result opinion expressed site company profile quotation material presentation publishes electronically print investor accept responsibility investment decision based independent research evaluation investment goal risk tolerance financial condition financialbuzzcom accessing website page thereof agree bound term use privacy policy amended time time content issued financialbuzzcom constitutes recommendation investor purchase hold sell particular security pursue particular investment strategy security suitable investor publication provided financialbuzzcom investor solely responsible determining particular security investment strategy suitable based objective security holding financial situation need tax status agree consult investment advisor tax legal consultant making investment decision representation completeness accuracy timeless material provided material subject change notice obtained source believed reliable accuracy completeness not guaranteed disclaimer disclosure term use visit medium protected url source financialbuzzcom
2017-05-11 14:15:00,http://www.finanznachrichten.de/nachrichten-2017-05/40686510-lithion-energy-corp-shareholders-approve-cspa-to-sell-indonesian-property-interests-for-dollar-1-million-usd-lithion-also-posts-railroad-valley-lithium-pr-296.htm,0.464252553389044,vancouver british columbianewsfile corp june lithion energy corporation tsxv lnc company pleased announce completed sale equity interest pt gayo mineral resource pt linge mineral resource share purchase agreement spa private indonesia company term spa news release date march 9th private indonesian company pay company total yous equivalent approximately cad proceeds finance company lithium project nevada arizona review additional technology metal property evaluate potential corporate transaction finder fee yous paid armslength company association transaction not add significant cash balance sheet indonesian subsidiary held company financial liability added shawn westcott president director sale represents significant change lithions balance sheet enable company efficiently pursue growth strategy tsx venture exchange regulation service provider term defined policy tsx venture exchange accepts responsibility adequacy accuracy release visit company website wwwlithionenergycorpcom shawn westcott vancouver british columbia t e infocom caution forward looking statement certain statement news release not historical nature constitute forward looking statement meaning phrase applicable canadian security law statement include not limited statement concerning use proceeds spa company growth strategy company future performance statement reflect management current assumption expectation nature subject certain underlying assumption known unknown risk uncertainty factor cause actual result performance event materially different expressed implied forward looking statement risk include interpretation drill result geology grade continuity mineral deposit possibility future exploration development mining result not consistent expectation commodity currency price fluctuation failure obtain adequate financing regulatory recovery rate refinery cost inability identify successfully conclude corporate transaction relevant conversion factor permitting licensing risk general market mining exploration risk forwardlooking statement not construed investment advice reader perform detailed independent investigation analysis company encouraged seek independent professional advice making investment decision accordingly reader not place undue reliance forwardlooking statement required applicable security law company disclaims obligation update revise forward looking statement reflect event change circumstance occur date hereof
